{
  "engineBuild": 889,
  "fingerprints": {
    "algorithm": "smml.content-tree-sha256/1",
    "canonicalGameFingerprint": {
      "fileCount": 61385,
      "sha256": "481304077a026cb62c1f0a8a725519afe839d39ef11d3d6223d56821f08fb8d3",
      "totalFileBytes": 20600159517
    },
    "canonicalPolicy": "smml.canonical-game-policy/1",
    "installationExactFingerprint": {
      "fileCount": 61397,
      "sha256": "908123cc7e586adf21f1a5636242ebf2545183a9f3319fcf781748677559be71",
      "totalFileBytes": 20617246687
    },
    "rootFingerprints": [
      {
        "algorithm": "smml.content-tree-sha256/1",
        "path": "Cache",
        "sha256": "32c35f46162adb2d6da969d33eb71fda542136033b6bac58a9eaa022cce6d6aa"
      },
      {
        "algorithm": "smml.content-tree-sha256/1",
        "path": "ChallengeData",
        "sha256": "6861f414ba0c90195ea7d96a45efb0bfa24d6c104144e19fa438db5257bfa3a6"
      },
      {
        "algorithm": "smml.content-tree-sha256/1",
        "path": "Data",
        "sha256": "f4710feee3052900e3daff832238795e861f5f7f8d067f1270cc3a64c695fa25"
      },
      {
        "algorithm": "smml.content-tree-sha256/1",
        "path": "Release",
        "sha256": "293a38308f0ea89887bdc9c9344c5e047a58560c7fe76d9f18de4cf3250a6092"
      },
      {
        "algorithm": "smml.content-tree-sha256/1",
        "path": "Survival",
        "sha256": "1dfddaed983a8b243742fa0d36f06e9a45c47116bb716ff4b3ddf23ecf2c8463"
      }
    ],
    "targetFingerprints": [
      {
        "algorithm": "sha256",
        "path": "Cache/Bundle/core_data.cbo",
        "sha256": "682efa4378e69f1a711e1d2147c302fbdd0dc8035f841c948d50c50964181351"
      },
      {
        "algorithm": "sha256",
        "path": "Survival/Scripts/game/interactables/ResourceContainer.lua",
        "sha256": "ccd77da5aaa6b6a8e640dc115e123a7236f0df40e31b56277d01314371cdc042"
      },
      {
        "algorithm": "sha256",
        "path": "Survival/Scripts/game/SurvivalGame.lua",
        "sha256": "934beb15dff2f34638128a56aa1be8586e363bc1a5d564698e9b8f09bf9d35c4"
      },
      {
        "algorithm": "sha256",
        "path": "Survival/Scripts/game/SurvivalPlayer.lua",
        "sha256": "960d15b4a5f66e1fd9ea4af6bd81a6088893b9f71bd8c1ad9c6bafaa592ecf76"
      },
      {
        "algorithm": "sha256",
        "path": "Survival/Scripts/game/tools/CarryTool.lua",
        "sha256": "ddbb727a8fb687f290f35ff359d626bdcf4983930c51ad24daadd26ee8702dbf"
      }
    ]
  },
  "gameVersion": "1.0.6",
  "platform": {
    "compatibilityLayer": {
      "kind": "proton"
    },
    "gameArch": "x86_64",
    "gameOs": "windows",
    "hostArch": "x86_64",
    "hostOs": "linux"
  },
  "schema": "smml.game-target/1",
  "steamAppId": 387990,
  "steamBranch": "public",
  "steamBuildId": "25442087"
}
